Daimler fraudlently described the 1998	Communicate_categorization
the 1998 deal to avoid	Make_agreement_on_action
deal to avoid paying a	Avoiding
to avoid paying a premium	Commerce_pay
after Britain refused to provide	Agree_or_refuse_to_act
refused to provide $100 million	Supply
funding and component suppliers withdrew	Ingredients
and component suppliers withdrew their	Supply
component suppliers withdrew their support	Removing
car-maker to halt production .	Activity_stop
to halt production . pad+1	Manufacturing
MG Rover make cars ?	Manufacturing
Rover make cars ? pad+1	Vehicle
States can continue with its	Activity_ongoing
, some of the rules	Partitive
by the country were discriminatory	Political_locales
discriminatory to foreign operators .	Foreign_or_domestic_country
advertising that hits consumers from	Impact
video games contain advertisements ?	Containing
community in rural Tuscany near	Locale_by_use
Does Bocelli have a home	Possession
have a home in Tuscany	Buildings
Mike Campbell dented his car	Damaging
dented his car door in	Vehicle
Mike 's car have a	Vehicle
pad-1 Two sisters who know	Kinship
sisters who know their mother	Awareness
know their mother had genetic	Kinship
before she died of ovarian	Death
of ovarian cancer want to	Medical_conditions
ovarian cancer want to find	Desiring
want to find out her	Becoming_aware
: Did cancer cause their	Medical_conditions
Did cancer cause their mother	Causation
cause their mother 's death	Kinship
mother 's death ? pad+1	Death
did n't kill the four	Killing
with a gun , he	Weapon
, he used a knife	Using
Did Vaughn use a gun	Using
use a gun to kill	Weapon
gun to kill the four	Killing
1990s , Chinese officials made	Origin
, Chinese officials made land	Leadership
Chinese officials made land available	Causation
for a new hospital ,	Familiarity
a new hospital , and	Buildings
money for construction and operating	Building
construction and operating costs .	Operating_a_system
and operating costs . pad+1	Expensiveness
: Did officials from China	Leadership
for a new hospital ?	Familiarity
a new hospital ? pad+1	Buildings
pad-2 pad-1 City workers pretended	Locale_by_use
of the attack . pad+1	Attack
Were the city workers harmed	Locale_by_use
by the attack ? pad+1	Attack
Corporation a contract to manufacture	Documents
contract to manufacture , test	Manufacturing
manufacture , test , bottle	Operational_testing
test , bottle and store	Placing
bottle and store anthrax vaccine	Storing
, the company has announced	Businesses
company has announced . pad+1	Statement
Defense Department want BioPort Corporation	Desiring
Corporation to manufacture anthrax vaccine	Manufacturing
pad-1 Chemical weapon projectiles contain	Weapon
weapon projectiles contain a blasting	Containing
can be seen in an	Perception_experience
blasting tube visible outside the	Obviousness
was the third shooting in	Ordinal_numbers
the third shooting in recent	Killing
in recent weeks involving nuclear	Calendric_unit
involving nuclear weapons or facilities	Weapon
weapons or facilities in Russia	Locale_by_use
involve nuclear weapons or facilities	Weapon
weapons or facilities ? pad+1	Locale_by_use
has been chosen as a	Choosing
as a site to test	Locale_by_use
site to test military vaccines	Operational_testing
to test military vaccines against	Military
against germ warfare agents .	Hostile_encounter
germ warfare agents . pad+1	Active_substance
: Who chose the Dugway	Choosing
as a site to test	Locale_by_use
site to test vaccines ?	Operational_testing
Emergencies Ministry predicts a further	Predicting
predicts a further increase in	Increment
a further increase in 1999	Change_position_on_a_scale
concentration of toxic agents in	Toxic_substance
of toxic agents in marine	Active_substance
of chemical weapons . pad+1	Weapon
concentration of toxic agents in	Toxic_substance
of toxic agents in marine	Active_substance
of chemical weapons increased prior	Weapon
chemical weapons increased prior to	Change_position_on_a_scale
weapons increased prior to 1999	Time_vector
's chemical weapons incinerator has	Weapon
incinerator has passed a milestone	Traversing
, the destruction of 5	Destroying
5 million pounds of GB	Measure_mass
GB nerve agent . pad+1	Active_substance
: Who destroyed 5 million	Destroying
5 million pounds of GB	Measure_mass
GB nerve agent ? pad+1	Active_substance
pad-1 The military is training	Military
for the day a terrorist	Calendric_unit
just a bomb , but	Weapon
or biological weapon that would	Weapon
that would spew out an	Excreting
an invisible death . pad+1	Death
or biological weapon ? pad+1	Weapon
large-scale terrorist attack using chemical	Attack
terrorist attack using chemical ,	Using
or nuclear weapons , state	Weapon
, state officials say .	Leadership
state officials say . pad+1	Statement
small-scale terrorist attack using chemical	Attack
terrorist attack using chemical ,	Using
or nuclear weapons ? pad+1	Weapon
pad-2 pad-1 Unlike nuclear or	Similarity
or chemical weapons , biological	Weapon
, biological weapons can be	Weapon
biological weapons can be made	Capability
can be made with readily	Manufacturing
readily available materials or equipment	Ingredients
materials or equipment . pad+1	Gizmo
QN : Can nuclear weapons	Capability
Can nuclear weapons be made	Weapon
weapons be made with readily	Manufacturing
readily available materials or equipment	Ingredients
materials or equipment ? pad+1	Gizmo
pad-1 Sudan says it 's	Statement
it 's ready to sign	Activity_ready_state
ready to sign the international	Sign_agreement
sign the international convention banning	Political_locales
international convention banning chemical weapons	Prohibiting
banning chemical weapons . pad+1	Weapon
Will Sudan produce chemical weapons	Manufacturing
produce chemical weapons in the	Weapon
has a range of 500	Range
and is manufactured in Syria	Manufacturing
Syria with know-how from North	Expertise
with know-how from North Korea	Origin
QN : Can a Scud	Capability
Scud C fly 500 kilometers	Motion
pad-1 Some of the 14	Partitive
the 14 alleged bin Laden	Unattributed_information
bin Laden associates arrested in	Collaboration
Laden associates arrested in Jordan	Arrest
December have begun talking to	Activity_start
have begun talking to investigators	Chatting
Was an associate of bin	Collaboration
bin Laden arrested in the	Arrest
Thursday unanimously approved legislation designed	Grant_permission
approved legislation designed to punish	Coming_up_with
designed to punish Russia and	Rewards_and_punishments
if they help Iran develop	Assistance
help Iran develop weapons of	Cause_to_make_progress
Iran develop weapons of mass	Weapon
Will Russia help Iran develop	Assistance
help Iran develop weapons of	Cause_to_make_progress
Iran develop weapons of mass	Weapon
pad-1 To date , Congress	Continued_state_of_affairs
for U.S. programs aimed at	Project
aimed at helping Russia and	Assistance
Russia and other newly independent	Increment
newly independent states reduce the	Political_locales
independent states reduce the threats	Cause_change_of_position_on_a_scale
by their weapons of mass	Weapon
the U.S. want the threat	Desiring
Russia 's weapons of mass	Weapon
to be reduced ? pad+1	Cause_change_of_position_on_a_scale
admitted to hospital with strychnine	Buildings
with strychnine poisoning after consuming	Cause_harm
poisoning after consuming Herron products	Ingestion
Herron products contain poison ?	Containing
products contain poison ? pad+1	Toxic_substance
About 400 of the more	Partitive
than 2,600 village residents were	Locale_by_use
2,600 village residents were hospitalized	Residence
residents were hospitalized in July	Institutionalization
Were some of the village	Partitive
the village residents not hospitalized	Residence
residents not hospitalized in July	Institutionalization
pad-1 The only bacterial attack	Sole_instance
only bacterial attack in America	Attack
a cult poisoned a salad	Cause_harm
a biological attack occurred in	Attack
biological attack occurred in the	Event
pad-1 Blix said the new	Statement
the new weapons inspection team	Weapon
new weapons inspection team is	Inspecting
weapons inspection team is composed	Aggregate
composed of scientists from around	People_by_vocation
world , including South America	Inclusion
: Are scientists from Hungary	People_by_vocation
from Hungary members of the	Membership
new weapons inspection team ?	Inspecting
weapons inspection team ? pad+1	Aggregate
Biological select agents include about	Active_substance
select agents include about 40	Inclusion
, and toxins whose transfer	Toxic_substance
toxins whose transfer within the	Transfer
Is the transfer of biological	Transfer
biological select agents within the	Active_substance
During his trip to five	Travel
, which ended last Monday	Process_end
, Powell proposed easing sanctions	Statement
proposed easing sanctions on Iraqi	Revenge
on Iraqi imports . pad+1	Importing
did Powell travel to ?	Travel
will be able to detect	Capability
able to detect a range	Becoming_aware
of biological agents . pad+1	Active_substance
a handheld device ? pad+1	Gizmo
Russia could suspend the destruction	Activity_pause
suspend the destruction of its	Destroying
of its stockpile of chemical	Store
of chemical weapons if foreign	Weapon
weapons if foreign aid is	Foreign_or_domestic_country
if foreign aid is not	Assistance
is not increased , a	Cause_change_of_position_on_a_scale
a senior official and negotiator	Leadership
quoted as saying by the	Statement
Does Russia have a stockpile	Possession
have a stockpile of chemical	Store
of chemical weapons ? pad+1	Weapon
is the sole U.S. manufacturer	Sole_instance
sole U.S. manufacturer of an	Manufacturing
QN : Are there three	Existence
three U.S. manufacturers of anthrax	Manufacturing
have been found in Kabul	Locating
the computers belong to Al	Possession
House has ordered a purge	Request
ordered a purge of information	Removing
purge of information from government	Information
information from government agency websites	Organization
by terrorists seeking weapons of	Seeking_to_achieve
terrorists seeking weapons of mass	Weapon
22 million jobs and 16.4	Being_employed
million people employed in agriculture	Being_employed
Pentagon is considering a resumption	Cogitation
U.S. troops occurred previously ?	Event
pad-1 Libya said on Wednesday	Statement
is not developing chemical ,	Cause_to_make_progress
or nuclear weapons , denying	Weapon
weapons , denying allegations made	Statement
, denying allegations made by	Statement
a US official . pad+1	Leadership
a U.S. official claim that	Leadership
U.S. official claim that Libya	Statement
Libya is developing chemical ,	Cause_to_make_progress
or nuclear weapons ? pad+1	Weapon
organisations whose assets have been	Possession
States amid suspicions that it	Awareness
might be giving support to	Giving
's al-Qaeda network . pad+1	Network
Who has given support to	Giving
Sunday Telegraph reported about a	Statement
a `` secret multi-million-pound deal	Secrecy_status
secret multi-million-pound deal with the	Be_in_agreement_on_action
the Indian government which will	Leadership
which will supply banned materials	Supply
will supply banned materials used	Prohibiting
supply banned materials used to	Ingredients
banned materials used to manufacture	Using
used to manufacture poison gas	Manufacturing
to manufacture poison gas .	Toxic_substance
manufacture poison gas . ''	Substance
Under the deal , India	Be_in_agreement_on_action
India will build a sophisticate	Building
a sophisticate chemical plant at	Substance
sophisticate chemical plant at Qazvin	Locale_by_use
will be used produce phosphorous	Using
be used produce phosphorous pentasulfide	Manufacturing
a dual-use chemical that could	Substance
chemical that could be used	Capability
used to produce chemical weapons	Manufacturing
produce chemical weapons . pad+1	Weapon
Has India built dual-use chemical	Building
built dual-use chemical production plants	Substance
dual-use chemical production plants in	Manufacturing
chemical production plants in Iran	Locale_by_use
Sunday Telegraph reported about a	Statement
a `` secret multi-million-pound deal	Secrecy_status
secret multi-million-pound deal with the	Be_in_agreement_on_action
the Indian government which will	Leadership
which will supply banned materials	Supply
will supply banned materials used	Prohibiting
supply banned materials used to	Ingredients
banned materials used to manufacture	Using
used to manufacture poison gas	Manufacturing
to manufacture poison gas .	Toxic_substance
manufacture poison gas . ''	Substance
Under the deal , India	Be_in_agreement_on_action
India will build a sophisticate	Building
a sophisticate chemical plant at	Substance
sophisticate chemical plant at Qazvin	Locale_by_use
will be used produce phosphorous	Using
be used produce phosphorous pentasulfide	Manufacturing
a dual-use chemical that could	Substance
chemical that could be used	Capability
used to produce chemical weapons	Manufacturing
produce chemical weapons . pad+1	Weapon
What dual-use chemical will be	Substance
will be produced at the	Manufacturing
, China supplied Iran with	Supply
with 40,000 barrels of calcium	Measure_volume
chemical-biological-radiological decontamination agent . pad+1	Active_substance
Has China provided Iran with	Supply
with decontamination materials ? pad+1	Substance
pad-1 Iran continues to deny	Activity_ongoing
continues to deny any allegations	Statement
deny any allegations that it	Statement
pursuing an offensive CW program	Attack
offensive CW program . pad+1	Project
so that government authorities could	Organization
that government authorities could familiarize	Leadership
government authorities could familiarize themselves	Capability
with their duties and obligations	Being_obligated
duties and obligations under the	Being_obligated
under the treaty . pad+1	Be_in_agreement_on_action
Has Iran denied developing CW	Statement
Iran denied developing CW ?	Cause_to_make_progress
the few countries in the	Political_locales
experienced chemical warfare ( CW	Hostile_encounter
, Iran ratified the Chemical	Ratification
Iran a signatory to the	Sign_agreement
America to end its destabilising	Cause_to_end
destabilising missile sales to countries	Commerce_sell
sales to countries such as	Political_locales
pad-1 That demand was reportedly	Request
demand was reportedly knocked down	Unattributed_information
reportedly knocked down by the	Cause_change_of_position_on_a_scale
of satellite launches and some	Shoot_projectiles
some food aid , but	Assistance
but the potential deal still	Capability
the potential deal still lacked	Be_in_agreement_on_action
lacked a key component-how to	Importance
component-how to verify that North	Verification
Korea was honouring the bargain-when	Compliance
the Clinton team ran out	Aggregate
pad-1 So missile sales still	Weapon
So missile sales still flourish	Commerce_sell
Korean still export missiles ?	Exporting
America to end its destabilising	Cause_to_end
destabilising missile sales to countries	Commerce_sell
sales to countries such as	Political_locales
pad-1 That demand was reportedly	Request
demand was reportedly knocked down	Unattributed_information
reportedly knocked down by the	Cause_change_of_position_on_a_scale
of satellite launches and some	Shoot_projectiles
some food aid , but	Assistance
but the potential deal still	Capability
the potential deal still lacked	Be_in_agreement_on_action
lacked a key component-how to	Importance
component-how to verify that North	Verification
Korea was honouring the bargain-when	Compliance
the Clinton team ran out	Aggregate
pad-1 So missile sales still	Weapon
So missile sales still flourish	Commerce_sell
Clinton administration agree to send	Agree_or_refuse_to_act
agree to send $1 billion	Sending
year to end the DPRK	Cause_to_end
's missile sales ? pad+1	Commerce_sell
America to end its destabilising	Cause_to_end
destabilising missile sales to countries	Commerce_sell
sales to countries such as	Political_locales
pad-1 That demand was reportedly	Request
demand was reportedly knocked down	Unattributed_information
reportedly knocked down by the	Cause_change_of_position_on_a_scale
of satellite launches and some	Shoot_projectiles
some food aid , but	Assistance
but the potential deal still	Capability
the potential deal still lacked	Be_in_agreement_on_action
lacked a key component-how to	Importance
component-how to verify that North	Verification
Korea was honouring the bargain-when	Compliance
the Clinton team ran out	Aggregate
pad-1 So missile sales still	Weapon
So missile sales still flourish	Commerce_sell
: What countries has North	Political_locales
North Korea bought missiles from	Commerce_buy
Korea bought missiles from ?	Weapon
North Korea confirmed U.S. intelligence	Verification
U.S. intelligence reports that it	Statement
had a clandestine enriched uranium	Secrecy_status
a clandestine enriched uranium weapons	Degree_of_processing
clandestine enriched uranium weapons program	Substance
enriched uranium weapons program in	Weapon
uranium weapons program in violation	Project
program in violation of the	Compliance
North Korea complied with the	Compliance
aerial-delivered chemical ordnance ( bombs	Weapon
, possibly other types of	Increment
possibly other types of ordnance	Type
types of ordnance ) ,	Weapon
, DPRK military airfields (	Military
DPRK military airfields ( as	Locale_by_use
) have posted a platoon	Sending
of chemical defense personnel equipped	Defend
chemical defense personnel equipped decontamination	Employing
defense personnel equipped decontamination and	Supply
and detection systems . pad+1	Gizmo
Korea taken steps to protect	Intentionally_act
steps to protect its military	Protecting
protect its military airfields from	Military
its military airfields from chemical	Locale_by_use
from chemical weapons attacks ?	Weapon
chemical weapons attacks ? pad+1	Attack
pad-1 The continued willingness of	Process_continue
The continued willingness of the	Willingness
Russia to provide Iran with	Supply
with both missiles and missile-related	Weapon
and missile-related technology that at	Artifact
exceed the intentions of the	Purpose
by the willingness of other	Willingness
) to cooperate within the	Collaboration
ballistic missile development . pad+1	Cause_to_make_progress
: What countries have provided	Political_locales
countries have provided Iran with	Supply
with ballistic missiles and missile-related	Weapon
and missile-related technology ? pad+1	Artifact
pad-1 The continued willingness of	Process_continue
The continued willingness of the	Willingness
Russia to provide Iran with	Supply
with both missiles and missile-related	Weapon
and missile-related technology that at	Artifact
exceed the intentions of the	Purpose
by the willingness of other	Willingness
) to cooperate within the	Collaboration
ballistic missile development . pad+1	Cause_to_make_progress
Middle Eastern countries have been	Political_locales
have been collaborating with Iran	Collaboration
Iran to develop their own	Cause_to_make_progress
own ballistic missiles ? pad+1	Weapon
has no plans to help	Purpose
plans to help secure three	Assistance
to help secure three other	Protecting
Russian nerve agent storage sites	Active_substance
nerve agent storage sites that	Storing
agent storage sites that store	Locale_by_use
sites that store 65 percent	Storing
declared nerve agent stockpile .	Active_substance
nerve agent stockpile . pad+1	Store
DOD ) plan to secure	Purpose
plan to secure all of	Protecting
's CW stockpiles ? pad+1	Store
chemical weapons storage facilities lack	Storing
weapons storage facilities lack a	Locale_by_use
storage facilities lack a basic	Possession
basic automatic alarm system to	Noise_makers
automatic alarm system to warn	Gizmo
levels of agent in the	Active_substance
's CW stockpile is that	Store
that people living near the	Residence
near the storage sites will	Storing
the storage sites will be	Locale_by_use
to these agents . pad+1	Active_substance
's chemical weapons facilities have	Weapon
chemical weapons facilities have systems	Locale_by_use
facilities have systems to detect	Gizmo
systems to detect the accidental	Perception_experience
of chemical weapons ? pad+1	Weapon
the Soviet government constructed a	Leadership
Soviet government constructed a demonstration	Building
a demonstration destruction facility in	Destroying
Chapayevsk that utilized neutralization and	Using
and incineration technology . pad+1	Artifact
pad-1 The facility , which	Locale_by_use
which was designed to destroy	Coming_up_with
designed to destroy 350 tons	Destroying
agent yearly utilizing hydrolysis followed	Using
incineration , cost 50 million	Expensiveness
rubles and took more than	Taking_time
than three years to build	Measure_duration
years to build . pad+1	Building
Has Russia built facilities for	Building
Russia built facilities for the	Locale_by_use
of chemical weapons in the	Weapon
Russia currently lacks the necessary	Possession
lacks the necessary capacity to	Being_necessary
its chemical munitions . pad+1	Ammunition
Does Russia possess the infrastructure	Possession
possess the infrastructure necessary to	Infrastructure
the infrastructure necessary to destroy	Being_necessary
necessary to destroy chemical weapons	Destroying
destroy chemical weapons ? pad+1	Weapon
gas were produced , tests	Manufacturing
in 19931994 reportedly found arsenic	Unattributed_information
19931994 reportedly found arsenic concentrations	Becoming_aware
the former plant to be	Locale_by_use
times the permissible concentration (	Legality
; in areas of the	Locale
times the permissible concentration .	Legality
QN : Is there evidence	Existence
Is there evidence that Russia	Evidence
's chemical weapons programs have	Weapon
chemical weapons programs have polluted	Project
Qadhafi has ordered kidnappings and	Request
and both supported and employed	Taking_sides
supported and employed international terrorism	Using
Libya sponsored acts of terrorism	Intentionally_act
pad-1 Russian scientists familiar with	People_by_vocation
Russian scientists familiar with Moscow	Expertise
's chemical warfare development program	Hostile_encounter
chemical warfare development program have	Cause_to_make_progress
warfare development program have been	Project
been publicizing information on a	Information
on a new generation of	Familiarity
generation of agents , sometimes	Active_substance
pad-1 These scientists report that	People_by_vocation
These scientists report that these	Statement
, were designed to circumvent	Coming_up_with
detection and protection measures .	Protecting
it is claimed that their	Statement
that their production can be	Manufacturing
their production can be hidden	Capability
commercial chemical plants . pad+1	Locale_by_use
Is Russia producing chemical weapons	Manufacturing
producing chemical weapons that can	Weapon
weapons that can be concealed	Capability
pad-1 Tehran continues to seek	Activity_ongoing
continues to seek considerable production	Seeking_to_achieve
seek considerable production technology ,	Manufacturing
considerable production technology , training	Artifact
technology , training , expertise	Education_teaching
training , expertise , equipment	Expertise
expertise , equipment and chemicals	Gizmo
equipment and chemicals from entities	Substance
China that could be used	Capability
could be used to help	Using
used to help Iran reach	Assistance
help Iran reach its goal	Arriving
reach its goal [ of	Purpose
indigenous nerve agent production capability	Active_substance
nerve agent production capability .	Manufacturing
agent production capability . pad+1	Capability
Does Iran want to be	Desiring
a self-sufficient producer of CW	Manufacturing
producer of CW ? pad+1	Weapon
1990s Iran reportedly acquires 120	Unattributed_information
Iran reportedly acquires 120 tons	Getting
acquires 120 tons of castor	Measure_mass
beans , used in the	Using
in the production of the	Manufacturing
of the toxin ricin .	Toxic_substance
QN : Is there evidence	Existence
Is there evidence that Iran	Evidence
Iran has attempted to produce	Attempt
attempted to produce ricin ?	Manufacturing
Iran has ratified the Biological	Ratification
) and publicly decried all	Secrecy_status
and publicly decried all forms	Judgment_communication
decried all forms of weapons	Type
forms of weapons of mass	Weapon
very sophisticated biotechnology infrastructure that	Artifact
sophisticated biotechnology infrastructure that includes	Infrastructure
infrastructure that includes leading research	Inclusion
that includes leading research facilities	First_rank
includes leading research facilities and	Research
leading research facilities and trained	Locale_by_use
facilities and trained personnel .	Education_teaching
has also participated in several	Participation
several scientific exchanges with foreign	Discussion
with foreign experts . pad+1	Expertise
have the infrastructure necessary to	Infrastructure
the infrastructure necessary to produce	Being_necessary
necessary to produce bioweapons ?	Manufacturing
1998 Iranian President Mohammad Khatami	Leadership
Mohammad Khatami reaffirms his administration	Statement
administration 's desire to cooperate	Desiring
desire to cooperate with the	Collaboration
He also declares that Iran	Statement
neither currently planning to build	Purpose
planning to build nuclear weapons	Building
nor will attempt to do	Attempt
any nuclear technology will be	Artifact
will be applied to developing	Using
applied to developing nuclear energy	Cause_to_make_progress
developing nuclear energy for peaceful	Electricity
for peaceful purposes . pad+1	Purpose
offered to cooperate with the	Collaboration
pad-1 Russian officials do not	Leadership
do not deny research has	Statement
not deny research has continued	Research
research has continued but assert	Process_continue
continued but assert that it	Statement
for the purpose of developing	Purpose
purpose of developing defenses against	Cause_to_make_progress
against chemical weapons , a	Weapon
, a purpose that is	Purpose
is not banned by the	Prohibiting
of the components for new	Ingredients
