facilities for research on combating	Research
spread of disease . pad+1	Medical_conditions
of these facilities , the	Locale_by_use
primarily on diseases affecting human	Medical_conditions
on diseases affecting human beings	Objective_influence
affecting human beings , while	People
while the third facility ,	Ordinal_numbers
the third facility , the	Locale_by_use
focuses on diseases affecting both	Medical_conditions
on diseases affecting both humans	Objective_influence
affecting both humans and other	People
humans and other animals such	Increment
have vaccine development and production	Cause_to_make_progress
development and production experience dating	Intentionally_create
and production experience dating back	Expertise
for many years both of	Measure_duration
of these facilities were recognized	Locale_by_use
the most advanced of their	Stage_of_progress
of their kind in the	Type
in the developing world .	Progress
the developing world . pad+1	Political_locales
all three facilities undertake projects	Locale_by_use
three facilities undertake projects requiring	Attempt
facilities undertake projects requiring advanced	Project
projects requiring advanced microbiology and	Stage_of_progress
genetic engineering equipment and expertise	Gizmo
equipment and expertise that could	Expertise
could be applied toward the	Using
toward the production of biological	Manufacturing
of biological weapons . pad+1	Weapon
NRCGEB 's research in recombinant	Research
recombinant DNA technologies , genetic	Artifact
DNA vaccine production could conceivably	Intentionally_create
conceivably be utilized to increase	Using
utilized to increase the virulence	Cause_change_of_position_on_a_scale
pad-1 The equipment for mass	Gizmo
mass - producing vaccines and	Manufacturing
could be utilized to mass	Using
mass - produce biological weapons	Manufacturing
produce biological weapons as well	Weapon
As is evident from the	Obviousness
Culture Collection discussed below ,	Topic
Iran clearly possesses technology useful	Possession
clearly possesses technology useful for	Artifact
possesses technology useful for producing	Usefulness
useful for producing biological weapons	Manufacturing
producing biological weapons ( as	Weapon
the Facilities section of this	Part_whole
pad-1 What remains unclear is	State_continue
What remains unclear is whether	Obviousness
is indeed proceeding with a	Activity_ongoing
a BW program . pad+1	Project
pad-2 pad-1 Like many facilities	Similarity
Like many facilities throughout the	Locale_by_use
that have similar or even	Similarity
even more advanced capabilities ,	Stage_of_progress
more advanced capabilities , these	Capability
, these facilities are open	Locale_by_use
facilities are open to public	Secrecy_status
to public scrutiny . pad+1	Scrutiny
Also , like many facilities	Similarity
like many facilities in the	Locale_by_use
's leading biotechnology research and	Artifact
leading biotechnology research and development	Research
research and development facilities create	Cause_to_make_progress
and development facilities create valuable	Locale_by_use
development facilities create valuable vaccine	Intentionally_create
that are distributed in Iran	Dispersal
throughout the world . pad+1	Political_locales
pad-1 Other Names : Tehran	Being_named
AKU ) has 7000 students	Possession
has 7000 students in undergraduate	Education_teaching
pad-1 It has 14 engineering	Possession
, five research centers ,	Research
five research centers , and	Locale_by_use
and an associate university complex	Collaboration
an associate university complex located	Locale_by_use
associate university complex located at	Locale_by_use
university complex located at the	Being_located
at the town of Tafresh	Political_locales
pad-1 AKU employs 480 full	Employing
- time teachers and 550	Education_teaching
550 administrative employees . pad+1	Employing
pad-2 pad-1 Primary Function :	First_rank
Function : Education , development	Education_teaching
Education , development of post	Cause_to_make_progress
- graduate studies , expansion	Education_teaching
studies , expansion of industrial	Cause_expansion
expansion of industrial and academic	Manufacturing
and academic links , and	Make_cognitive_connection
, and establishment of new	Intentionally_create
establishment of new research laboratories	Familiarity
of new research laboratories .	Research
new research laboratories . pad+1	Locale_by_use
pad-2 pad-1 Founded in 1958	Intentionally_create
, AKU underwent a series	Undergoing
after the revolution to align	Change_of_leadership
pad-1 The first independent biomedical	Ordinal_numbers
Iran was established at AKU	Intentionally_create
which incorporate traditional engineering programs	Custom
to address problems associated with	Predicament
address problems associated with human	Cognitive_connection
physiology , treatment , and	Cure
, and rehabilitation . pad+1	Cure
is the largest university laboratory	Dimension
the largest university laboratory fostering	Locale_by_use
largest university laboratory fostering research	Locale_by_use
laboratory fostering research in the	Research
area of synthesis , processing	Intentionally_create
synthesis , processing , and	Processing_materials
, and modification of materials	Cause_change
modification of materials for use	Ingredients
materials for use in biological	Using
pad-1 This laboratory is especially	Locale_by_use
is especially active in the	Being_active
of polymeric materials with the	Ingredients
with the objective of modifying	Purpose
objective of modifying the physical	Cause_change
of polymeric materials to render	Ingredients
materials to render them biocompatible	Causation
render them biocompatible . pad+1	Compatibility
pad-1 The laboratory 's specific	Locale_by_use
's specific research areas include	Research
research areas include the design	Inclusion
include the design and processing	Coming_up_with
processing of systems for controlled	Gizmo
and targeted delivery of bioactive	Delivery
of bioactive agents . pad+1	Active_substance
university places emphasis on its	Place_weight_on
its strong relationship with the	Cognitive_connection
nation 's industries and the	Fields
the practical application of its	Using
of its training programs .	Education_teaching
its training programs . pad+1	Project
pad-2 pad-1 According to the	Attributed_information
Iran has purchased dual -	Commerce_buy
has purchased dual - use	Cardinal_numbers
dual - use equipment using	Purpose
- use equipment using the	Gizmo
use equipment using the science	Using
science and technology center at	Artifact
and technology center at Amir	Locale_by_use
Defense News reports that AKU	Statement
has been used as a	Using
as a front company to	Front_for
company to purchase the following	Commerce_buy
the following equipment from the	Gizmo
, and training from NCR	Education_teaching
of these technologies appears to	Artifact
these technologies appears to be	Appearance
be directly related to biological	Cognitive_connection
to biological weapons . pad+1	Weapon
Damascus University signed a mutual	Sign_agreement
mutual scientific cooperation agreement that	Collaboration
scientific cooperation agreement that called	Make_agreement_on_action
agreement that called for broadened	Request
, and research cooperation between	Research
and research cooperation between the	Collaboration
, the exchange of professors	Exchange
exchange of professors and students	Education_teaching
professors and students , the	Education_teaching
and the formation of a	Creating
committee to probe into the	Scrutiny
the few countries in the	Political_locales
in the world that has	Political_locales
has experienced chemical warfare (	Weapon
experienced chemical warfare ( CW	Hostile_encounter
, Iran ratified the Chemical	Ratification
pad-2 pad-1 Iranian troops suffered	Origin
Iranian troops suffered tens of	Catastrophe
casualties from Iraqi chemical weapons	Origin
Iraqi chemical weapons during the	Weapon
- Iraq War . pad+1	Hostile_encounter
a very public stance against	Secrecy_status
against the use of chemical	Using
of chemical weapons , making	Weapon
numerous vitriolic comments against Iraq	Statement
Iraq 's use of such	Using
of such weapons in international	Weapon
weapons in international forums .	Political_locales
several Western officials accuse Iran	Leadership
Western officials accuse Iran of	Judgment_communication
Iran of developing similar offensive	Cause_to_make_progress
of developing similar offensive CW	Similarity
similar offensive CW capabilities .	Weapon
offensive CW capabilities . pad+1	Capability
pad-1 US officials report that	Leadership
US officials report that Iran	Statement
that Iran can produce several	Capability
Iran can produce several hundred	Manufacturing
several hundred tons of chemical	Measure_mass
of chemical agent annually and	Active_substance
have already produced as much	Manufacturing
as 2,000 tons of agent	Measure_mass
tons of agent , including	Active_substance
agent , including mustard ,	Inclusion
sarin nerve agent , at	Active_substance
, at plants near Qazvin	Locale_by_use
pad-2 pad-1 Officials also claim	Leadership
Officials also claim that Iran	Statement
Iran has produced bombs and	Manufacturing
has produced bombs and artillery	Weapon
artillery rounds filled with these	Filling
with these agents , and	Active_substance
that it can probably deploy	Capability
it can probably deploy chemical	Likelihood
can probably deploy chemical warheads	Arranging
deploy chemical warheads on its	Weapon
- range missiles . pad+1	Weapon
Iran is suspected of having	Suspicion
of having developed such a	Cause_to_make_progress
such a capability with aid	Capability
capability with aid from individuals	Assistance
aid from individuals and companies	People
individuals and companies in the	Businesses
extensive CW program is allegedly	Project
program is allegedly masked using	Unattributed_information
allegedly masked using its sophisticated	Using
using its sophisticated pharmaceutical and	Stage_of_progress
agro - industrial companies as	Manufacturing
- industrial companies as plausible	Businesses
is further claimed that these	Statement
that these companies serve as	Businesses
as a front for importing	Front_for
front for importing important chemical	Importing
for importing important chemical precursors	Importance
importing important chemical precursors and	Weapon
important chemical precursors and related	Ingredients
precursors and related equipment ,	Cognitive_connection
and related equipment , which	Gizmo
Iranian CW program . pad+1	Project
pad-1 Although information on WMD	Information
on WMD programs for many	Project
for many countries is often	Political_locales
comes to assessing Iran 's	Assessing
Iran 's alleged CW program	Unattributed_information
alleged CW program , one	Project
one must sift through a	Scouring
through a mountain of information	Quantity
mountain of information , much	Information
long on allegation and short	Statement
specific , corroborated evidence .	Evidence
, corroborated evidence . pad+1	Evidence
of the information can be	Information
just a handful of sources	Quantity
handful of sources , none	Source_of_getting
of which can be independently	Capability
be independently verified . pad+1	Verification
of the sources have a	Source_of_getting
- existing bias against Iran	Partiality
Iran , rendering a bulk	Causation
of their information subject to	Information
following profile attempts to piece	Attempt
to piece together an objective	Building
overview of allegations surrounding Iran	Statement
its CW capabilities by mining	Capability
mining through reports in open	Text
reports in open source literature	Secrecy_status
from a variety of sources	Aggregate
variety of sources . pad+1	Source_of_getting
Iran 's entanglement with CW	Participation
entanglement with CW stems from	Weapon
- Iraq War . pad+1	Hostile_encounter
during the war with Iraq	Hostile_encounter
, Iran suffered extensive CW	Catastrophe
extensive CW attacks , including	Attack
attacks , including blister (	Inclusion
and nerve agents . pad+1	Active_substance
By the end of the	Process_end
, Iran appeared to have	Appearance
to have suffered as many	Catastrophe
50,000 chemical warfare casualties ,	Hostile_encounter
perhaps 5,000 died . pad+1	Death
pad-1 The weak international response	Exertive_force
The weak international response ,	Political_locales
weak international response , particularly	Response
to Iraqi use of chemical	Using
weapons against Iranian forces left	Origin
against Iranian forces left Iran	Military
what it perceived to be	Categorization
in enforcing international agreements .	Political_locales
enforcing international agreements . pad+1	Make_agreement_on_action
pad-1 Many Iranian officials concluded	Origin
Many Iranian officials concluded that	Leadership
Iranian officials concluded that their	Coming_to_believe
that their country had to	Political_locales
country had to develop the	Being_obligated
had to develop the ability	Cause_to_make_progress
develop the ability to retaliate	Capability
ability to retaliate in kind	Revenge
deter chemical weapons use against	Weapon
chemical weapons use against it	Using
In a public interview ,	Secrecy_status
, the Iranian representative to	Origin
Korassani , stated that ``	Statement
the Iraqi regime does not	Leadership
take any steps in putting	Intentionally_act
putting an end to the	Cause_to_end
to the crimes of the	Committing_crime
the Iraqi regime , we	Leadership
we will retaliate in kind	Revenge
will certainly announce it .	Statement
However , several Iranian officials	Quantity
, several Iranian officials has	Origin
several Iranian officials has never	Leadership
hidden his abhorrence of CW	Experiencer_focus
of CW use in battlefield	Using
are some reports that between	Statement
1988 Iran employed chemical agents	Using
employed chemical agents on a	Active_substance
during the war with Iraq	Hostile_encounter
of the open literature (	Secrecy_status
literature ( including UN reports	Inclusion
including UN reports from that	Text
) have failed to verify	Successful_action
failed to verify such claims	Evidence
verify such claims . pad+1	Statement
invoking the threat of CW	Risky_situation
CW in retaliation if the	Revenge
if the world community failed	Political_locales
the world community failed to	Aggregate
take any action against Iraq	Intentionally_act
several Iranian leaders felt that	Leadership
felt that developing a CW	Cause_to_make_progress
a CW program would counteract	Project
the Iraqi threat and prove	Risky_situation
be a strong deterrent ,	Exertive_force
regime publicly condemned any use	Judgment_communication
condemned any use of chemicals	Using
use of chemicals on moral	Substance
chemicals on moral grounds ,	Morality_evaluation
grounds , calling them un	Labeling
pad-2 pad-1 Disagreement over a	Quarreling
of policy action led to	Intentionally_act
policy action led to several	Causation
led to several contradictory published	Quantity
contradictory published reports whether or	Text
not Iran decided to pursue	Deciding
a CW program . pad+1	Project
its offensive capability is somewhat	Capability
can definitely conclude that Iran	Coming_to_believe
that Iran has a defensive	Possession
has a defensive program that	Defend
a defensive program that can	Project
into offensive production , if	Manufacturing
if Iranian national security is	Political_locales
Iranian national security is threatened	Being_at_risk
Though there is no concrete	Existence
no concrete evidence that Iran	Evidence
is currently developing CW ,	Cause_to_make_progress
currently developing CW , there	Weapon
there have been several instances	Existence
been several instances where CW	Instance
instances where CW precursors were	Weapon
where CW precursors were purchased	Ingredients
precursors were purchased from foreign	Commerce_buy
purchased from foreign sources in	Foreign_or_domestic_country
from foreign sources in the	Source_of_getting
United States accused Germany of	Judgment_communication
Germany of selling dual -	Commerce_sell
of selling dual - use	Cardinal_numbers
dual - use materials and	Purpose
- use materials and technology	Ingredients
materials and technology to Iran	Artifact
1989 US authorities found Alcolac	Leadership
US authorities found Alcolac International	Verdict
a pharmaceutical firm based out	Businesses
Maryland , guilty of illegally	Verdict
of illegally shipping almost 120	Sending
almost 120 tons of thiodyglycol	Measure_mass
mustard gas precursor ) to	Ingredients
pad-1 The same year ,	Identicality
The same year , US	Calendric_unit
23 specific chemicals that could	Substance
that could aid CW proliferation	Assistance
could aid CW proliferation .	Weapon
of India admitted that it	Statement
it had sold Iran over	Commerce_sell
over 60 tons of thionyl	Measure_mass
nerve agent precursor ) and	Ingredients
that its supplier was planning	Supply
planning to ship an additional	Sending
ship an additional 257 tons	Increment
additional 257 tons of the	Measure_mass
of the chemical to Iran	Substance
under a reported multi -	Statement
million dollar deal , India	Make_agreement_on_action
, India agreed to construct	Make_agreement_on_action
agreed to construct a ``	Building
`` sophisticated chemical plant at	Substance
sophisticated chemical plant at Qazvim	Locale_by_use
India also agreed to sell	Make_agreement_on_action
agreed to sell Iran phosphorous	Commerce_sell
, a dual - use	Cardinal_numbers
dual - use chemical used	Purpose
- use chemical used in	Substance
use chemical used in the	Using
in the production of pesticides	Manufacturing
the nerve agent VX .	Active_substance
pad-1 The deal eventually fell	Make_agreement_on_action
and a similar deal was	Similarity
a similar deal was eventually	Make_agreement_on_action
was eventually concluded with China	Activity_finish
pad-1 China reportedly agreed to	Unattributed_information
China reportedly agreed to sell	Make_agreement_on_action
agreed to sell Iran 500	Commerce_sell
Iran 500 tons of phosphorus	Measure_mass
also been involved in several	Participation
involved in several other sales	Quantity
several other sales to Iran	Commerce_sell
, involving CW technology ;	Weapon
involving CW technology ; as	Artifact
, several Chinese companies and	Origin
several Chinese companies and individuals	Businesses
companies and individuals have faced	People
faced American sanctions . pad+1	Revenge
pad-1 One example was the	Instance
the 1997 sale by China	Commerce_sell
of 40,000 barrels of calcium	Measure_volume
biological decontaminating agent . pad+1	Active_substance
pad-2 pad-1 Other defensive material	Increment
pad-1 Other defensive material purchased	Defend
Other defensive material purchased by	Substance
defensive material purchased by Iran	Commerce_buy
by Iran includes respirators from	Inclusion
, protective gear from South	Gizmo
, and atropine autoinjectors from	Substance
Department for supplying Iran with	Supply
nerve gas technology . ''	Artifact
pad-2 pad-1 According to US	Attributed_information
US press accounts citing a	Text
a top secret CIA report	Secrecy_status
secret CIA report dated 2	Text
, China sold Iran nearly	Commerce_sell
400 metric tons of carbon	Measure_mass
control gas precursor . pad+1	Ingredients
, two more Chinese companies	Increment
two more Chinese companies and	Origin
more Chinese companies and were	Businesses
Department for selling Iran CW	Commerce_sell
selling Iran CW related precursors	Weapon
Iran CW related precursors and	Cognitive_connection
CW related precursors and equipment	Ingredients
precursors and equipment . pad+1	Supply
pad-1 The companies involved were	Businesses
The companies involved were Nanjing	Participation
They were accused of exporting	Judgment_communication
accused of exporting thionyl chloride	Import_export
of the CW agents Iran	Weapon
the CW agents Iran has	Active_substance
Iran has allegedly developed include	Unattributed_information
has allegedly developed include CS	Cause_to_make_progress
allegedly developed include CS gas	Inclusion
riot control agent ) ,	Active_substance
, mustard gas , hydrogen	Weapon
pad-1 Some sources , citing	Source_of_getting
sources , citing US intelligence	Adducing
citing US intelligence officials ,	Organization
US intelligence officials , also	Leadership
, also claim that Iran	Statement
Iran has developed sarin ,	Cause_to_make_progress
series nerve agents . pad+1	Active_substance
pad-1 There are several delivery	Existence
There are several delivery routes	Quantity
are several delivery routes Iran	Delivery
its chemical agents . pad+1	Active_substance
Iran is said to have	Statement
to have developed 155 mm	Cause_to_make_progress
have also been rumors of	Existence
also been rumors of using	Unattributed_information
rumors of using mines to	Using
of using mines to deliver	Weapon
to deliver CW agents (	Weapon
deliver CW agents ( 120	Active_substance
known Shahab missile is also	Weapon
is also believed to be	Certainty
to be capable of carrying	Capability
capable of carrying chemical warheads	Bringing
carrying chemical warheads , although	Weapon
it is uncertain warheads have	Certainty
is uncertain warheads have been	Weapon
have been developed or tested	Cause_to_make_progress
developed or tested . pad+1	Operational_testing
, Iran tested a new	Operational_testing
tested a new version of	Familiarity
a new version of its	Type
unmanned aerial vehicle ( UAV	Vehicle
which some experts claim could	Expertise
some experts claim could be	Statement
could be used for potential	Using
used for potential CBW delivery	Capability
potential CBW delivery . pad+1	Delivery
Despite its acquisition of precursors	Getting
acquisition of precursors from abroad	Ingredients
working to develop an indigenous	Cause_to_make_progress
develop an indigenous CW production	Indigenous_origin
an indigenous CW production capability	Weapon
indigenous CW production capability .	Manufacturing
CW production capability . pad+1	Capability
The CIA believes that ``	Awareness
is rapidly approaching self-sufficiency and	Arriving
self-sufficiency and could become a	Capability
and could become a supplier	Becoming
become a supplier of CW	Supply
supplier of CW - related	Weapon
CW - related materials to	Cognitive_connection
- related materials to other	Ingredients
materials to other nations .	Increment
to other nations . ''	Political_locales
of Defense claimed that Iran	Statement
Iran had stockpiled almost 2000	Amassing
almost 2000 tons of toxic	Measure_mass
tons of toxic chemical agents	Toxic_substance
toxic chemical agents and was	Active_substance
working on expanding its CW	Cause_expansion
expanding its CW program .	Weapon
its CW program . pad+1	Project
pad-1 Iran has several advanced	Possession
has several advanced research institutions	Stage_of_progress
several advanced research institutions employing	Research
research institutions employing various chemicals	Using
employing various chemicals for a	Substance
for a variety of reasons	Aggregate
variety of reasons , including	Causation
reasons , including pesticide production	Inclusion
including pesticide production , pharmaceutical	Manufacturing
, pharmaceutical research , and	Research
other medical studies . pad+1	Scrutiny
has also conducted several military	Intentionally_act
conducted several military exercises to	Military
several military exercises to date	Practice
that have included defensive chemical	Inclusion
have included defensive chemical and	Defend
and biological weapons maneuvers .	Weapon
pad-1 Iran continues to deny	Activity_ongoing
continues to deny any allegations	Statement
deny any allegations that it	Statement
is actively pursuing an offensive	Cotheme
pursuing an offensive CW program	Attack
an offensive CW program .	Weapon
offensive CW program . pad+1	Project
held the first regional seminar	Ordinal_numbers
the first regional seminar on	Locale
the national implementation of the	Execute_plan
so that government authorities could	Leadership
that government authorities could familiarize	Leadership
with their duties and obligations	Being_obligated
duties and obligations under the	Being_obligated
under the treaty . pad+1	Documents
`` trial inspection '' at	Inspecting
factory to allow inspectors to	Permitting
to allow inspectors to see	Scrutiny
inspectors to see how such	Grasp
procedure was conducted . pad+1	Intentionally_act
submitted a declaration on its	Statement
its chemical facilities and its	Locale_by_use
its past CW stockpile ,	Weapon
past CW stockpile , it	Store
it has destroyed chemical weapons	Destroying
destroyed chemical weapons production equipment	Weapon
chemical weapons production equipment in	Manufacturing
weapons production equipment in the	Gizmo
of OPCW inspectors , and	Scrutiny
it has undergone a number	Undergoing
undergone a number of OPCW	Quantity
of OPCW inspections of its	Inspecting
chemical industrial facilities . pad+1	Locale_by_use
pad-1 Iran continues to play	Activity_ongoing
play an active role at	Being_active
as a member in good	Membership
intelligence agencies continue to insist	Activity_ongoing
continue to insist Iran maintains	Statement
maintains a stockpile of chemical	Store
of chemical weapons , no	Weapon
no challenge inspections of Iranian	Inspecting
inspections of Iranian facilities have	Origin
of Iranian facilities have been	Locale_by_use
have been requested , and	Request
of the allegations made regarding	Statement
allegations made regarding the stockpiling	Topic
regarding the stockpiling of CW	Amassing
stockpiling of CW can be	Weapon
can be verified in the	Verification
in the unclassified domain .	Secrecy_status
, Iran continues to retain	Activity_ongoing
incentive for developing a defensive	Cause_to_make_progress
developing a defensive CW program	Defend
a defensive CW program .	Weapon
defensive CW program . pad+1	Project
summary lists key Iranian imports	Importance
key Iranian imports within the	Import_export
of its CW program .	Weapon
its CW program . pad+1	Project
pad-1 Several chemicals are dual	Substance
chemicals are dual - use	Cardinal_numbers
dual - use in nature	Purpose
nature and imported under the	Importing
