officials to defect to the	Quitting_a_place
Yop , said in April	Statement
the DPRK military was able	Military
military was able to do	Capability
able to do just that	Intentionally_act
that , using a combination	Using
and nuclear weapons delivered by	Weapon
delivered by missiles . pad+1	Weapon
in actually employing CW agents	Using
actually employing CW agents ,	Hostile_encounter
employing CW agents , not	Active_substance
mention their manufacture and storage	Manufacturing
manufacture and storage . pad+1	Storing
availability of oil - derived	Substance
oxide , makes the large	Causation
- scale manufacture of simple	Manufacturing
of simple CW agents such	Hostile_encounter
simple CW agents such as	Active_substance
within the capabilities of the	Capability
is not clear how well	Obviousness
would be able to manufacture	Capability
able to manufacture large quantities	Manufacturing
manufacture large quantities of nerve	Quantity
of nerve agents , such	Active_substance
unavailability of precursors required to	Ingredients
of precursors required to manufacture	Being_necessary
required to manufacture some nerve	Manufacturing
some nerve agents may very	Active_substance
DPRK logistical supply network .	Supply
logistical supply network . pad+1	Network
was caught exporting 50 kg	Exporting
of cargo vessels bringing food	Vehicle
cargo vessels bringing food aid	Bringing
, this chemical was intended	Substance
intended for use by a	Using
for electroplating purposes . pad+1	Purpose
also a precursor for sarin	Ingredients
soman nerve agents , the	Active_substance
the Japanese authorities arrested the	Leadership
Japanese authorities arrested the individual	Arrest
arrested the individual ( himself	People
a Japanese citizen ) for	People_by_jurisdiction
relatively small amount ( 50kg	Quantity
of this chemical had little	Substance
in terms of producing militarily	Domain
a serious problem faced by	Predicament
namely the lack of domestically	Possession
domestically - manufactured chemical precursors	Manufacturing
- manufactured chemical precursors .	Substance
manufactured chemical precursors . pad+1	Ingredients
a single-minded emphasis on buttressing	Place_weight_on
buttressing its military capabilities despite	Military
its military capabilities despite a	Capability
despite a poverty - stricken	Wealthiness
- stricken economy and populace	Economy
of the CW stockpile in	Weapon
the CW stockpile in the	Store
the more sophisticated and lethal	Stage_of_progress
sophisticated and lethal nerve agent	Killing
lethal nerve agent variety ,	Active_substance
nerve agent variety , it	Type
, it may contain a	Likelihood
it may contain a large	Inclusion
contain a large quantity of	Dimension
a large quantity of casualty	Quantity
of casualty agents such as	Active_substance
are relatively easy to manufacture	Difficulty
easy to manufacture . pad+1	Manufacturing
the Chemical Weapons Convention pad+1	Weapon
In the early 1990s --	Temporal_subregion
1990s -- according to reports	Attributed_information
according to reports from DPRK	Text
People's Armed Forces debated over	Military
Armed Forces debated over whether	Discussion
whether to join the Chemical	Becoming_a_member
apparently in favor of participating	Taking_sides
favor of participating in the	Participation
, the military was opposed	Military
Il apparently sided with the	Taking_sides
South Korean government has insisted	Leadership
government has insisted that the	Statement
the DPRK join the CWC	Becoming_a_member
has also rebuffed efforts on	Respond_to_proposal
also rebuffed efforts on the	Attempt
of the Organization for the	Organization
for the Prohibition of Chemical	Prohibiting
of Chemical Weapons ( OPCW	Weapon
the Japanese government , to	Leadership
, to persuade it to	Suasion
it to participate in the	Participation
in the chemical disarmament regime	Substance
the chemical disarmament regime .	Emptying
North Korea wishes to foster	Desiring
a viable chemical industry ,	Substance
viable chemical industry , a	Fields
, a case could be	Reasoning
- term economic sense by	Economy
sense by giving it access	Giving
- controlled chemicals and technology	Substance
chemicals and technology . pad+1	Artifact
, a knowledgeable official at	Expertise
a knowledgeable official at the	Leadership
benefits by joining the CWC	Becoming_a_member
pad-2 pad-1 Nuclear Capabilities pad+1	Weapon
pad-2 pad-1 Countries developing clandestine	Political_locales
pad-1 Countries developing clandestine nuclear	Cause_to_make_progress
Countries developing clandestine nuclear weapons	Secrecy_status
clandestine nuclear weapons programs usually	Weapon
nuclear weapons programs usually go	Project
to conceal information about these	Information
about these programs from the	Project
from the outside world .	Part_inner_outer
the outside world . pad+1	Political_locales
Therefore , obtaining reliable open	Getting
, obtaining reliable open source	Trust
obtaining reliable open source information	Secrecy_status
open source information on such	Information
on such programs is very	Project
is very challenging . pad+1	Difficulty
pad-1 The lack of reliable	Possession
lack of reliable information typically	Trust
of reliable information typically results	Information
in substantial uncertainty about the	Certainty
size and capabilities of these	Capability
of these clandestine programs .	Secrecy_status
these clandestine programs . pad+1	Project
Nonetheless , countries suspected of	Political_locales
, countries suspected of having	Awareness
suspected of having clandestine nuclear	Possession
of having clandestine nuclear weapons	Secrecy_status
clandestine nuclear weapons programs are	Weapon
nuclear weapons programs are the	Project
of intense scrutiny by nonproliferation	Scrutiny
by nonproliferation analysts , intelligence	Scrutiny
analysts , intelligence agencies ,	Information
, and other observers .	Increment
fuzzy picture emerges from the	Coming_to_be
from the analysis , albeit	Scrutiny
gaps in understanding . pad+1	Awareness
The resulting analysis can set	Scrutiny
on the uncertainties , while	Certainty
, while producing a range	Creating
range of estimates of the	Estimated_value
of the country 's capabilities	Political_locales
country 's capabilities . pad+1	Capability
pad-2 pad-1 Analytic tools include	Scrutiny
pad-1 Analytic tools include examining	Gizmo
Analytic tools include examining statements	Inclusion
tools include examining statements and	Scrutiny
include examining statements and articles	Statement
statements and articles in the	Text
media , government reports including	Organization
, government reports including unclassified	Text
government reports including unclassified intelligence	Inclusion
reports including unclassified intelligence estimates	Secrecy_status
including unclassified intelligence estimates ,	Information
unclassified intelligence estimates , interviewing	Estimated_value
who have had access to	Possession
access to information about the	Information
about the clandestine program ,	Secrecy_status
the clandestine program , reviewing	Project
reviewing secondary sources such as	Source_of_getting
such as reports by analysts	Text
reports by analysts , and	Scrutiny
on the best available information	Desirability
best available information about a	Information
about a country 's nuclear	Political_locales
's nuclear infrastructure . pad+1	Infrastructure
pad-1 Technical analysis of clandestine	Scrutiny
analysis of clandestine programs is	Secrecy_status
of clandestine programs is based	Project
the widely known physical and	Awareness
of nuclear materials and weapons	Substance
materials and weapons , which	Weapon
which enable estimates of capabilities	Estimated_value
estimates of capabilities based on	Capability
fragmentary and uncertain information ,	Certainty
and uncertain information , as	Information
pad-1 Nuclear weapons programs require	Weapon
Nuclear weapons programs require specialized	Project
weapons programs require specialized materials	Have_as_requirement
require specialized materials , facilities	Ingredients
materials , facilities , equipment	Locale_by_use
facilities , equipment , and	Gizmo
, and training in order	Education_teaching
training in order to produce	Purpose
order to produce the raw	Manufacturing
produce the raw material for	Degree_of_processing
the raw material for weapons	Ingredients
material for weapons -- either	Weapon
either highly enriched uranium (	Degree_of_processing
highly enriched uranium ( HEU	Substance
) or plutonium -- and	Substance
then to fabricate explosive devices	Manufacturing
to fabricate explosive devices using	Weapon
fabricate explosive devices using this	Gizmo
explosive devices using this fissile	Using
this fissile material . pad+1	Substance
pad-2 pad-1 Weapons programs can	Weapon
pad-1 Weapons programs can be	Project
Weapons programs can be based	Capability
based on indigenous ( i.e.	Indigenous_origin
domestic ) production capabilities ,	Manufacturing
) production capabilities , or	Capability
or they can rely on	Capability
they can rely on foreign	Reliance
rely on foreign supplies and	Foreign_or_domestic_country
on foreign supplies and technologies	Store
supplies and technologies . pad+1	Artifact
Virtually all weapons programs use	Weapon
all weapons programs use some	Project
weapons programs use some foreign	Using
use some foreign inputs ,	Foreign_or_domestic_country
, if only technical information	Sole_instance
only technical information culled from	Information
and engineering sources . pad+1	Source_of_getting
, all countries known to	Political_locales
all countries known to have	Awareness
have successfully acquired nuclear weapons	Getting
acquired nuclear weapons have done	Weapon
weapons have done so primarily	Intentionally_act
of indigenously produced fissile material	Manufacturing
produced fissile material . pad+1	Substance
pad-1 A plutonium - based	Substance
- based bomb program requires	Weapon
based bomb program requires capabilities	Project
bomb program requires capabilities to	Have_as_requirement
program requires capabilities to mine	Capability
mine and mill uranium ,	Grinding
and mill uranium , process	Substance
uranium , process it into	Processing_materials
it into reactor fuel ,	Locale_by_use
fuel , transform the isotopic	Cause_change
in a reactor , extract	Locale_by_use
reactor , extract plutonium from	Removing
, extract plutonium from the	Substance
from the spent fuel ,	Used_up
fuel , form the plutonium	Reshaping
form the plutonium into the	Substance
- implosion weapon , and	Weapon
, and develop and test	Cause_to_make_progress
develop and test high explosives	Operational_testing
test high explosives used to	Weapon
high explosives used to initiate	Using
, even reactor - grade	Locale_by_use
- grade plutonium can be	Substance
grade plutonium can be used	Capability
can be used as fissile	Using
as fissile material in nuclear	Substance
in nuclear weapons . pad+1	Weapon
pad-1 A uranium - based	Substance
- based bomb program requires	Weapon
based bomb program requires capabilities	Project
bomb program requires capabilities to	Have_as_requirement
program requires capabilities to mine	Capability
mine and mill uranium ,	Grinding
and mill uranium , and	Substance
and to enrich it to	Processing_materials
it to weapons - grade	Weapon
near - weapons - grade	Weapon
the Hiroshima bomb used less	Weapon
than - weapons - grade	Weapon
- grade uranium ) .	Substance
pad-1 An advanced weapons program	Stage_of_progress
An advanced weapons program would	Weapon
advanced weapons program would require	Project
program would require the capability	Have_as_requirement
require the capability to manufacture	Capability
capability to manufacture tritium ,	Manufacturing
a radioactive gas that can	Substance
gas that can be used	Capability
can be used to enhance	Using
of nuclear weapons , for	Weapon
, for fabrication of boosted	Manufacturing
- yield weapons . pad+1	Weapon
pad-1 While countries may seek	Political_locales
countries may seek to develop	Seeking_to_achieve
seek to develop all of	Cause_to_make_progress
of these capabilities on an	Capability
independent , indigenous basis ,	Indigenous_origin
, they can and often	Capability
often do seek some inputs	Seeking_to_achieve
inputs from foreign sources .	Foreign_or_domestic_country
from foreign sources . pad+1	Source_of_getting
they may purchase raw or	Commerce_buy
may purchase raw or milled	Degree_of_processing
raw or milled uranium ore	Ground_up
or milled uranium ore from	Substance
and then use indigenous facilities	Using
then use indigenous facilities to	Indigenous_origin
use indigenous facilities to enrich	Locale_by_use
facilities to enrich it to	Processing_materials
it to weapons - grade	Weapon
- grade material . pad+1	Ingredients
many nuclear weapons a country	Weapon
weapons a country can produce	Political_locales
country can produce with a	Manufacturing
a given amount of fissile	Quantity
of fissile material requires knowing	Substance
fissile material requires knowing the	Have_as_requirement
material requires knowing the technological	Awareness
of the country and the	Political_locales
of the weapons . pad+1	Weapon
on data supplied by the	Supply
jure nuclear weapons states ,	Weapon
nuclear weapons states , the	Political_locales
Safeguards Division defines quantities of	Categorization
quantities of concern as 8kg	Emotion_directed
8kg of plutonium and 25kg	Substance
However , sophisticated nuclear weapons	Stage_of_progress
sophisticated nuclear weapons reportedly use	Weapon
nuclear weapons reportedly use as	Unattributed_information
4kg of plutonium and/or 15	Substance
Council has estimated that a	Estimating
that a country with a	Political_locales
a `` high technical capability	Position_on_a_scale
high technical capability '' could	Capability
'' could require as little	Needing
1kg of weapons - grade	Weapon
- grade plutonium or 2.5kg	Substance
HEU to produce a one	Manufacturing
one kiloton bomb . pad+1	Weapon
The atomic bombs dropped on	Weapon
Nagasaki used low - level	Position_on_a_scale
low - level nuclear weapons	Rank
level nuclear weapons technology .	Weapon
nuclear weapons technology . pad+1	Artifact
The Hiroshima bomb , for	Weapon
example , employed about 50kg	Using
of 80% enriched uranium .	Degree_of_processing
80% enriched uranium . pad+1	Substance
In the case of North	Instance
its nuclear weapons program is	Weapon
nuclear weapons program is especially	Project
is especially difficult . pad+1	Difficulty
isolated and secretive state ,	Candidness
and secretive state , North	Political_locales
North Korea provides few signals	Supply
Korea provides few signals of	Quantity
of the existence -- let	Existence
its nuclear weapons program .	Weapon
nuclear weapons program . pad+1	Project
pad-2 pad-1 Key data sources	Importance
Key data sources for DPRK	Source_of_getting
for DPRK include defector testimony	Inclusion
unreliable given possibility of deliberate	Likelihood
by double agents and defectors	People_by_vocation
what they know , and	Awareness
, and unclassified estimates by	Secrecy_status
and unclassified estimates by US	Estimated_value
by US intelligence agencies ,	Information
have certain biases based on	Partiality
based on national interest ,	Political_locales
on national interest , worst	Emotion_directed
interest , worst - case	Desirability
expectations , domestic politics ,	Foreign_or_domestic_country
, most estimates do not	Estimated_value
due to translation issues .	Translating
massive Soviet weapons of mass	Weapon
mass destruction complex . pad+1	Locale_by_use
as its economy has collapsed	Economy
this oversized complex has strained	System
political and economic system .	Economy
and economic system . pad+1	System
nuclear and missile capabilities presupposes	Weapon
and missile capabilities presupposes its	Capability
presupposes its crucial role in	Importance
role in arms control and	Weapon
while the remnants of chemical	Remainder
and biological weapons programs pose	Weapon
biological weapons programs pose major	Project
environmental and proliferation threats .	Proliferating_in_number
Soviet nuclear weapon program began	Weapon
nuclear weapon program began during	Project
weapon program began during World	Process_start
in a successful atomic bomb	Successful_action
successful atomic bomb test in	Weapon
atomic bomb test in 1949	Operational_testing
a nuclear weapon state party	Weapon
nuclear weapon state party to	Political_locales
pad-2 pad-1 According to estimates	Attributed_information
According to estimates by the	Estimated_value
Soviet Union had approximately 35,000	Possession
approximately 35,000 weapons in its	Weapon
in its stockpile , down	Store
Russia is estimated to now	Estimating
to now have around 20,000	Possession
20,000 nuclear weapons , although	Weapon
although total stockpile size is	Store
size is uncertain because there	Certainty
because there is no accurate	Existence
is no accurate count of	Correctness
tactical nuclear weapons . pad+1	Weapon
2002 Russia declared it will	Statement
it will eliminate its tactical	Removing
tactical nuclear weapons by the	Weapon
by the end of 2004	Process_end
the Russian nuclear arsenal has	Weapon
Russian nuclear arsenal has been	Weapon
has been reduced to approximately	Cause_change_of_position_on_a_scale
7,000 strategic warheads . pad+1	Weapon
would have reduced this number	Cause_change_of_position_on_a_scale
strategic nuclear warheads . pad+1	Weapon
Moscow ) requires Russia to	Imposing_obligation
Russia to reduce the number	Cause_change_of_position_on_a_scale
number of deployed strategic warheads	Arranging
deployed strategic warheads to between	Weapon
by the end of 2012	Process_end
massive nuclear weapons production complex	Weapon
nuclear weapons production complex and	Manufacturing
weapons production complex and large	System
complex and large stocks of	Dimension
and large stocks of weapons	Store
stocks of weapons grade fissile	Weapon
grade fissile material . pad+1	Substance
It is estimated that Russia	Estimating
that Russia has between 735	Possession
1,365 metric tons ( t	Measure_mass
) of weapons grade -	Weapon
equivalent highly enriched uranium (	Degree_of_processing
highly enriched uranium ( HEU	Substance
t of military - use	Military
military - use plutonium .	Using
- use plutonium . pad+1	Substance
Soviet Union ratified the BWC	Ratification
Soviet Union violated the treaty	Compliance
violated the treaty by secretly	Be_in_agreement_on_action
treaty by secretly operating a	Secrecy_status
by secretly operating a massive	Operating_a_system
massive offensive BW program until	Weapon
offensive BW program until it	Project
The Soviet BW arsenal included	Hostile_encounter
Soviet BW arsenal included the	Weapon
BW arsenal included the causative	Inclusion
the causative agents of anthrax	Active_substance
wartime , formulated agents would	Coming_up_with
, formulated agents would have	Active_substance
have been loaded into a	Placing
into a variety of delivery	Aggregate
of delivery systems , including	Gizmo
systems , including aerial bombs	Inclusion
including aerial bombs and ballistic	Weapon
and ballistic missile warheads .	Weapon
ballistic missile warheads . pad+1	Weapon
Soviet BW scientists also researched	People_by_vocation
scientists also researched , developed	Research
researched , developed , and	Cause_to_make_progress
, and produced anti -	Manufacturing
- livestock agents . pad+1	Active_substance
the U.S. government believes that	Leadership
U.S. government believes that the	Awareness
that the BW agent stockpiles	Hostile_encounter
the BW agent stockpiles have	Active_substance
BW agent stockpiles have been	Store
have been destroyed , activities	Destroying
destroyed , activities that contravene	Intentionally_act
activities that contravene the BWC	Compliance
the BWC may continue at	Likelihood
BWC may continue at a	Process_continue
at a few military biological	Quantity
a few military biological facilities	Military
military biological facilities in Russia	Locale_by_use
Union also established a so	Intentionally_create
- plague system , whose	Gizmo
, whose primary objective was	First_rank
whose primary objective was to	Purpose
control endemic diseases and prevent	Medical_conditions
diseases and prevent the importation	Preventing
prevent the importation of exotic	Importing
, and humans . pad+1	People
In the late 1960s ,	Temporal_subregion
, the system also was	Gizmo
tasked with defending the USSR	Defend
against biological attacks . pad+1	Attack
- plague system continues in	Gizmo
plague system continues in today	Process_continue
There are reports that some	Statement
that some countries , including	Political_locales
countries , including Iran ,	Inclusion
, have attempted to hire	Attempt
attempted to hire Russian BW	Hiring
to hire Russian BW specialists	Origin
hire Russian BW specialists to	Weapon
specialists to help them acquire	Assistance
help them acquire biological weapons	Getting
acquire biological weapons . pad+1	Weapon
Soviet Union had the world	Possession
had the world 's largest	Political_locales
world 's largest arsenal of	Dimension
's largest arsenal of chemical	Weapon
of chemical weapons , including	Weapon
weapons , including artillery shells	Inclusion
, including artillery shells ,	Weapon
shells , bombs , and	Weapon
, and missiles that contained	Weapon
missiles that contained choking agents	Containing
contained choking agents ( phosgene	Active_substance
, nerve agents ( sarin	Active_substance
and blister agents ( mustard	Active_substance
have been allegations that the	Statement
Soviet Union developed a new	Cause_to_make_progress
developed a new class of	Familiarity
a new class of nerve	Type
of nerve agent ( Novichok	Active_substance
) , estimated to be	Estimating
times more toxic than VX	Toxic_substance
declared Soviet stockpile of 40,000	Store
40,000 metric tons of CW	Measure_mass
tons of CW munitions and	Weapon
of CW munitions and agents	Ammunition
munitions and agents stored in	Active_substance
and agents stored in bulk	Storing
, Russia ratified the CWC	Ratification
financial and other difficulties have	Increment
difficulties have impeded the destruction	Hindering
impeded the destruction of its	Destroying
its chemical weapons stockpile ,	Weapon
chemical weapons stockpile , so	Store
in the treaty . pad+1	Documents
pad-2 pad-1 Missile pad+1 pad+2	Weapon
the Soviet missile complex ,	Weapon
Soviet missile complex , although	Locale_by_use
, although significant portions are	Importance
although significant portions are located	Part_whole
portions are located in Ukraine	Being_located
has the capability to produce	Capability
capability to produce highly sophisticated	Manufacturing
produce highly sophisticated liquid -	Stage_of_progress
highly sophisticated liquid - and	Substance
- fueled missiles of all	Weapon
of all ranges . pad+1	Range
( NATO designation SS-27 )	Referring_by_name
SS-27 ) intercontinental ballistic missile	Range
intercontinental ballistic missile ( ICBM	Weapon
has been developed for silo	Cause_to_make_progress
developed for silo basing and	Locale_by_use
is under development . pad+1	Cause_to_make_progress
Although the possibility of deploying	Likelihood
possibility of deploying a MIRVed	Arranging
also been discussed in the	Discussion
, no steps in that	Intentionally_act
that direction appear to have	Appearance
, Russia continues to extend	Activity_ongoing
lives of existing types of	Existence
of existing types of MIRVed	Type
While no sea - launched	Natural_features
sea - launched ballistic missile	Shoot_projectiles
launched ballistic missile ( SLBM	Weapon
currently in production , Russia	Manufacturing
Russia is developing a new	Cause_to_make_progress
developing a new SLBM called	Familiarity
new SLBM called the Bulava	Being_named
to be deployed in the	Arranging
in the existing Typhoon class	Existence
Typhoon class submarines and in	Vehicle
in a new class of	Familiarity
a new class of ballistic	Type
of ballistic missile submarines currently	Weapon
ballistic missile submarines currently under	Vehicle
currently under construction . pad+1	Building
future a modification of Bulava	Cause_change
also be deployed in silos	Arranging
deployed in silos as a	Locale_by_use
are also plans to start	Purpose
plans to start production of	Activity_start
to start production of an	Manufacturing
variant , designated Sineva ,	Being_named
the Air Force reportedly began	Military
Air Force reportedly began to	Unattributed_information
Force reportedly began to receive	Activity_start
began to receive a new	Receiving
receive a new type of	Familiarity
a new type of strategic	Type
strategic cruise missile . pad+1	Weapon
pad-2 pad-1 Reports of exports	Statement
Reports of exports and leakage	Exporting
leakage of Russian missile technology	Origin
of Russian missile technology to	Weapon
Russian missile technology to countries	Artifact
technology to countries such as	Political_locales
Korea have led to concerns	Causation
led to concerns that Russia	Emotion_directed
Russia is contravening its obligations	Compliance
contravening its obligations as a	Being_obligated
as a member of the	Membership
Taiwan is claimed by both	Claim_ownership
and the authorities on Taiwan	Leadership
It is administered by the	Leadership
by the authorities on Taiwan	Leadership
does not possess nuclear weapons	Possession
possess nuclear weapons , but	Weapon
, but began a covert	Activity_start
began a covert nuclear weapons	Secrecy_status
covert nuclear weapons program in	Weapon
nuclear weapons program in 1964	Project
1964 that ended in 1988	Process_end
of U.S. pressure . pad+1	Attempt_suasion
pad-1 Taiwan signed the Nuclear	Sign_agreement
) `` Program 93+2 ''	Project
pad-1 Despite persistent suspicions of	Process_continue
offensive and defensive chemical and	Defend
and biological weapons ( CBW	Weapon
CBW ) programs , there	Project
, there is no conclusive	Existence
no conclusive evidence that Taiwan	Evidence
Taiwan has developed or deployed	Cause_to_make_progress
developed or deployed chemical or	Arranging
or biological weapons . pad+1	Weapon
